name,display_name,consent,gender,age_band,role,location,group_context,belonging_score,perceived_transparency,relational_clarity,psychological_safety,interests,close_contacts,support_contacts,trust_contacts,collaboration_contacts,influence_contacts,information_contacts,conflict_contacts,avoid_contacts,open_notes
Aina Soler,Aina Soler,yes,woman,20-24,student,Barcelona,TFG pilot group,8,7,8,8,"sociology, art, climbing","Laia Ferrer, Marc Vidal","Laia Ferrer, Júlia Serra","Laia Ferrer","Marc Vidal, Nora Puig","Marc Vidal","Nora Puig","","","Feels that the group is friendly but some dynamics are implicit."
Marc Vidal,Marc Vidal,yes,man,20-24,student,Barcelona,TFG pilot group,7,6,7,7,"data, politics, music","Oriol Costa, Aina Soler","Aina Soler, Nora Puig","Aina Soler, Oriol Costa","Aina Soler, Nora Puig","Nora Puig","Nora Puig, Laia Ferrer","Pau Riera","Pau Riera","Sees two informal subgroups."
Laia Ferrer,Laia Ferrer,yes,woman,20-24,student,Barcelona,TFG pilot group,9,8,8,9,"care, education, feminism","Aina Soler, Júlia Serra","Aina Soler, Júlia Serra","Aina Soler, Júlia Serra","Aina Soler","Aina Soler","Aina Soler, Nora Puig","","","Usually acts as emotional support."
Júlia Serra,Júlia Serra,yes,woman,20-24,student,Barcelona,TFG pilot group,8,7,6,8,"education, theatre, writing","Laia Ferrer, Aina Soler","Laia Ferrer","Laia Ferrer","Laia Ferrer, Aina Soler","Laia Ferrer","Laia Ferrer","","","Feels close to a small core."
Nora Puig,Nora Puig,yes,woman,25-29,coordinator,Barcelona,TFG pilot group,7,8,8,8,"data, organisations, social innovation","Marc Vidal, Aina Soler","Marc Vidal, Aina Soler","Marc Vidal","Marc Vidal, Aina Soler","Marc Vidal","Marc Vidal","","","Has information and coordination role."
Oriol Costa,Oriol Costa,yes,man,20-24,student,Barcelona,TFG pilot group,6,5,5,6,"politics, football, data","Marc Vidal, Pau Riera","Marc Vidal","Marc Vidal","Marc Vidal, Pau Riera","Marc Vidal","Marc Vidal","","","Feels the group has hidden hierarchies."
Pau Riera,Pau Riera,yes,man,20-24,student,Barcelona,TFG pilot group,4,3,4,4,"football, gaming, politics","Oriol Costa","Oriol Costa","Oriol Costa","Oriol Costa","Marc Vidal","Oriol Costa","Marc Vidal","Marc Vidal","Feels somewhat outside the main group."
Mireia Bosch,Mireia Bosch,yes,woman,20-24,student,Barcelona,TFG pilot group,5,4,5,5,"literature, care, cinema","Júlia Serra","Laia Ferrer","Júlia Serra","Júlia Serra","Laia Ferrer","Laia Ferrer","","","Participates less but observes many dynamics."
